{
  "id": "submersion",
  "category": "biome_blending",
  "trigger": {
    "type": "environmental",
    "weather_field": "water_level",
    "threshold": 0.2
  },
  "animation": {
    "frames": [
      4,
      8
    ],
    "duration_ms": [
      600,
      1200
    ],
    "loop": true,
    "intensity_variable": true,
    "blend_mode": "overlay"
  },
  "effects": {
    "particle": "water_shimmer"
  }
}
